{
  "schema_version": "cirsium-fresh-sentinel-movement-constraint-v1",
  "status": "PRE_GEOMETRY_MOVEMENT_CONSTRAINT_FROZEN",
  "source_identity": "ALGORITHM_DERIVED_NETWORK_TRANSITION_LIMIT_V1",
  "derivation_identity": "MATCH_FROZEN_COARSE_COVERAGE_SCALE_V1",
  "movement_constraint_mode": "osm_weighted_transport_network",
  "max_network_transition_km": 5.0,
  "derived_from_coarse_coverage_cell_size_m": 5000.0,
  "user_declared_value": false,
  "private_range_sector_geometry_opened_when_declared": false,
  "candidate_identity_used_to_set_constraint": false,
  "prospective_field_outcomes_opened": false,
  "field_outcomes_used_to_set_constraint": false,
  "survey_days_input": false,
  "monetary_budget_input": false,
  "user_site_count_input": false,
  "user_coverage_target_input": false,
  "post_geometry_edits_allowed": false,
  "post_outcome_edits_allowed": false
}
